name,location,role,skills,experience_years,email
Olivia Thompson,Los Angeles,Marketing Manager,Digital Marketing; SEO; Content Strategy; Analytics,6,olivia.thompson@marketingpro.com
William Johnson,Nashville,Sales Director,B2B Sales; CRM; Negotiation; Lead Generation,12,william.johnson@salesforce.com
Sophia Martinez,Phoenix,HR Specialist,Talent Acquisition; Employee Relations; HRIS; Onboarding,4,sophia.martinez@hrconnect.com
Ethan Davis,Salt Lake City,Finance Analyst,Financial Modeling; Excel; SQL; Budgeting,5,ethan.davis@financeanalyst.com
Isabella Garcia,Vancouver,Graphic Designer,Adobe Creative Suite; Branding; Illustration; Print Design,7,isabella.garcia@graphicdesign.com
Alexander Wilson,Raleigh,Project Manager,Project Planning; Risk Management; Stakeholder Communication; PMP,8,alex.wilson@projectmgmt.com
Charlotte Brown,Oklahoma City,Customer Success Manager,Customer Retention; Support; Product Knowledge; Analytics,5,charlotte.brown@customersuccess.com
Benjamin Lee,Colorado Springs,Operations Manager,Process Optimization; Team Leadership; KPI Tracking; Lean,9,benjamin.lee@operationspro.com
Ava Rodriguez,Albuquerque,Content Writer,SEO Writing; Blogging; Social Media; Copywriting,3,ava.rodriguez@contentwriter.com
Mason Chen,Tucson,Network Engineer,Cisco; Network Security; VPN; Firewall Configuration,6,mason.chen@networkeng.com
Harper Davis,Omaha,Legal Counsel,Contract Law; Intellectual Property; Compliance; Negotiation,10,harper.davis@legalcounsel.com
Elijah Park,Colorado Springs,Data Analyst,SQL; Excel; Power BI; Statistical Analysis,4,elijah.park@dataanalyst.com
Abigail Thompson,Wichita,Event Coordinator,Event Planning; Vendor Management; Budgeting; Logistics,5,abigail.thompson@eventcoord.com
Jackson Wilson,Fresno,Social Media Manager,Social Media Strategy; Content Creation; Community Management; Analytics,4,jackson.wilson@socialmedia.com
Ella Garcia,Bakersfield,Research Assistant,Research Methodology; Data Collection; Academic Writing; Literature Review,2,ella.garcia@researchassist.com
Logan Brown,Stockton,IT Support Specialist,Help Desk; Windows; macOS; Troubleshooting,3,logan.brown@itsupport.com
Grace Lee,Modesto,Administrative Assistant,Office Management; Scheduling; Microsoft Office; Communication,6,grace.lee@adminassist.com
Lucas Martinez,Fremont,Supply Chain Analyst,Inventory Management; ERP Systems; Demand Planning; Logistics,5,lucas.martinez@supplychain.com
Chloe Davis,Sacramento,Public Relations Specialist,Media Relations; Press Releases; Crisis Communication; Social Media,4,chloe.davis@prspecialist.com
Henry Rodriguez,Irvine,Business Development Manager,Partnership Development; Market Research; Sales Strategy; Negotiation,7,henry.rodriguez@bizdev.com